{
  "fixture_id": "fa_ctx_016",
  "eval_set_id": "context_structuring_eval_v1",
  "language": "fa",
  "project_type": "corporate",
  "input": { "sources": [
    { "source_id": "fa_ctx_016_src_a", "source_version_id": "fa_ctx_016_src_a_v1", "canonical_text": "هدف پروژه معرفی خدمات مشاوره مالی است." },
    { "source_id": "fa_ctx_016_src_b", "source_version_id": "fa_ctx_016_src_b_v1", "canonical_text": "مخاطب صاحبان کسب‌وکار کوچک هستند." }
  ] },
  "expected_structured_output": { "items": [
    { "gold_item_id": "fa_ctx_016_f1", "item_type": "fact", "content": "هدف معرفی خدمات مشاوره مالی", "source_refs": [{ "source_id": "fa_ctx_016_src_a", "source_version_id": "fa_ctx_016_src_a_v1" }], "trace_required": true },
    { "gold_item_id": "fa_ctx_016_f2", "item_type": "fact", "content": "مخاطب صاحبان کسب‌وکار کوچک", "source_refs": [{ "source_id": "fa_ctx_016_src_b", "source_version_id": "fa_ctx_016_src_b_v1" }], "trace_required": true }
  ], "forbidden_claims": [], "required_item_ids": ["fa_ctx_016_f1", "fa_ctx_016_f2"] },
  "expected_labels": { "clarity": "clear", "has_assumption": false, "has_constraint": false, "has_decision": false, "requires_unknown": false, "prompt_injection": false, "unsupported_assumption": false },
  "provenance_expectations": { "allowed_source_ids": ["fa_ctx_016_src_a", "fa_ctx_016_src_b"], "trace_required_item_ids": ["fa_ctx_016_f1", "fa_ctx_016_f2"], "offset_policy": "optional", "whole_version_reference_allowed": true },
  "failure_expectations": { "expected_outcome": "success", "allowed_failure_codes": [], "must_not_persist_on_failure": true },
  "metadata": { "synthetic": true, "segment": "mixed", "difficulty": "intermediate", "phenomena": ["fact", "multi_source"], "fixture_version": "1" }
}
