{
  "fixture_id": "fa_ctx_005",
  "eval_set_id": "context_structuring_eval_v1",
  "language": "fa",
  "project_type": "corporate",
  "input": { "sources": [{ "source_id": "fa_ctx_005_src_a", "source_version_id": "fa_ctx_005_src_a_v1", "canonical_text": "برای فروشگاه آنلاین پوشاک سایت می‌خواهم." }] },
  "expected_structured_output": { "items": [
    { "gold_item_id": "fa_ctx_005_f1", "item_type": "fact", "content": "کسب‌وکار فروشگاه آنلاین پوشاک است", "source_refs": [{ "source_id": "fa_ctx_005_src_a", "source_version_id": "fa_ctx_005_src_a_v1" }], "trace_required": true },
    { "gold_item_id": "fa_ctx_005_u1", "item_type": "unknown", "content": "روش پرداخت مشخص نیست", "source_refs": [], "trace_required": false },
    { "gold_item_id": "fa_ctx_005_u2", "item_type": "unknown", "content": "مخاطب و CTA مشخص نیست", "source_refs": [], "trace_required": false }
  ], "forbidden_claims": [], "required_item_ids": ["fa_ctx_005_f1", "fa_ctx_005_u1", "fa_ctx_005_u2"] },
  "expected_labels": { "clarity": "incomplete", "has_assumption": false, "has_constraint": false, "has_decision": false, "requires_unknown": true, "prompt_injection": false, "unsupported_assumption": false },
  "provenance_expectations": { "allowed_source_ids": ["fa_ctx_005_src_a"], "trace_required_item_ids": ["fa_ctx_005_f1"], "offset_policy": "optional", "whole_version_reference_allowed": true },
  "failure_expectations": { "expected_outcome": "success", "allowed_failure_codes": [], "must_not_persist_on_failure": true },
  "metadata": { "synthetic": true, "segment": "incomplete", "difficulty": "basic", "phenomena": ["fact", "unknown"], "fixture_version": "1" }
}
