{
  "fixture_id": "fa_ctx_001",
  "eval_set_id": "context_structuring_eval_v1",
  "language": "fa",
  "project_type": "landing",
  "input": { "sources": [{ "source_id": "fa_ctx_001_src_a", "source_version_id": "fa_ctx_001_src_a_v1", "canonical_text": "برای کافه دانه یک لندینگ فارسی می‌خواهیم. هدف اصلی رزرو میز است. مخاطب ساکنان محله‌اند. CTA باید «رزرو میز» باشد." }] },
  "expected_structured_output": { "items": [
    { "gold_item_id": "fa_ctx_001_f1", "item_type": "fact", "content": "کسب‌وکار کافه دانه است", "source_refs": [{ "source_id": "fa_ctx_001_src_a", "source_version_id": "fa_ctx_001_src_a_v1" }], "trace_required": true },
    { "gold_item_id": "fa_ctx_001_f2", "item_type": "fact", "content": "مخاطب ساکنان محله‌اند", "source_refs": [{ "source_id": "fa_ctx_001_src_a", "source_version_id": "fa_ctx_001_src_a_v1" }], "trace_required": true },
    { "gold_item_id": "fa_ctx_001_d1", "item_type": "decision", "content": "CTA رزرو میز", "source_refs": [{ "source_id": "fa_ctx_001_src_a", "source_version_id": "fa_ctx_001_src_a_v1" }], "trace_required": true }
  ], "forbidden_claims": [], "required_item_ids": ["fa_ctx_001_f1", "fa_ctx_001_f2", "fa_ctx_001_d1"] },
  "expected_labels": { "clarity": "clear", "has_assumption": false, "has_constraint": false, "has_decision": true, "requires_unknown": false, "prompt_injection": false, "unsupported_assumption": false },
  "provenance_expectations": { "allowed_source_ids": ["fa_ctx_001_src_a"], "trace_required_item_ids": ["fa_ctx_001_f1", "fa_ctx_001_f2", "fa_ctx_001_d1"], "offset_policy": "optional", "whole_version_reference_allowed": true },
  "failure_expectations": { "expected_outcome": "success", "allowed_failure_codes": [], "must_not_persist_on_failure": true },
  "metadata": { "synthetic": true, "segment": "clear", "difficulty": "basic", "phenomena": ["fact", "decision"], "fixture_version": "1" }
}
