{
  "fixture_id": "fa_ctx_006",
  "eval_set_id": "context_structuring_eval_v1",
  "language": "fa",
  "project_type": "landing",
  "input": { "sources": [{ "source_id": "fa_ctx_006_src_a", "source_version_id": "fa_ctx_006_src_a_v1", "canonical_text": "سایت باید کاملاً مینیمال باشد و هم‌زمان صفحه اول پر از بنرهای متحرک و عناصر تزئینی باشد." }] },
  "expected_structured_output": { "items": [
    { "gold_item_id": "fa_ctx_006_c1", "item_type": "constraint", "content": "درخواست سبک مینیمال", "source_refs": [{ "source_id": "fa_ctx_006_src_a", "source_version_id": "fa_ctx_006_src_a_v1" }], "trace_required": true },
    { "gold_item_id": "fa_ctx_006_d1", "item_type": "decision", "content": "بنر متحرک و عناصر تزئینی", "source_refs": [{ "source_id": "fa_ctx_006_src_a", "source_version_id": "fa_ctx_006_src_a_v1" }], "trace_required": true },
    { "gold_item_id": "fa_ctx_006_u1", "item_type": "unknown", "content": "تعارض سبک حل نشده", "source_refs": [], "trace_required": false }
  ], "forbidden_claims": [], "required_item_ids": ["fa_ctx_006_c1", "fa_ctx_006_d1", "fa_ctx_006_u1"] },
  "expected_labels": { "clarity": "contradictory", "has_assumption": false, "has_constraint": true, "has_decision": true, "requires_unknown": true, "prompt_injection": false, "unsupported_assumption": false },
  "provenance_expectations": { "allowed_source_ids": ["fa_ctx_006_src_a"], "trace_required_item_ids": ["fa_ctx_006_c1", "fa_ctx_006_d1"], "offset_policy": "optional", "whole_version_reference_allowed": true },
  "failure_expectations": { "expected_outcome": "success", "allowed_failure_codes": [], "must_not_persist_on_failure": true },
  "metadata": { "synthetic": true, "segment": "contradictory", "difficulty": "intermediate", "phenomena": ["constraint", "decision", "unknown"], "fixture_version": "1" }
}
