{
  "fixture_id": "fa_ctx_012",
  "eval_set_id": "context_structuring_eval_v1",
  "language": "fa",
  "project_type": "landing",
  "input": { "sources": [{ "source_id": "fa_ctx_012_src_a", "source_version_id": "fa_ctx_012_src_a_v1", "canonical_text": "سلام. سایت برای کلینیک پوست است. نوبت آنلاین مهم است. رنگ‌ها آرام باشند." }] },
  "expected_structured_output": { "items": [
    { "gold_item_id": "fa_ctx_012_f1", "item_type": "fact", "content": "پروژه برای کلینیک پوست است", "source_refs": [{ "source_id": "fa_ctx_012_src_a", "source_version_id": "fa_ctx_012_src_a_v1" }], "trace_required": true },
    { "gold_item_id": "fa_ctx_012_d1", "item_type": "decision", "content": "نوبت آنلاین", "source_refs": [{ "source_id": "fa_ctx_012_src_a", "source_version_id": "fa_ctx_012_src_a_v1" }], "trace_required": true },
    { "gold_item_id": "fa_ctx_012_c1", "item_type": "constraint", "content": "رنگ‌های آرام", "source_refs": [{ "source_id": "fa_ctx_012_src_a", "source_version_id": "fa_ctx_012_src_a_v1" }], "trace_required": true }
  ], "forbidden_claims": [], "required_item_ids": ["fa_ctx_012_f1", "fa_ctx_012_d1", "fa_ctx_012_c1"] },
  "expected_labels": { "clarity": "clear", "has_assumption": false, "has_constraint": true, "has_decision": true, "requires_unknown": false, "prompt_injection": false, "unsupported_assumption": false },
  "provenance_expectations": { "allowed_source_ids": ["fa_ctx_012_src_a"], "trace_required_item_ids": ["fa_ctx_012_f1", "fa_ctx_012_d1", "fa_ctx_012_c1"], "offset_policy": "optional", "whole_version_reference_allowed": true },
  "failure_expectations": { "expected_outcome": "success", "allowed_failure_codes": [], "must_not_persist_on_failure": true },
  "metadata": { "synthetic": true, "segment": "fragmented", "difficulty": "basic", "phenomena": ["fact", "decision", "constraint"], "fixture_version": "1" }
}
