{
  "fixture_id": "fa_ctx_010",
  "eval_set_id": "context_structuring_eval_v1",
  "language": "fa",
  "project_type": "corporate",
  "input": { "sources": [{ "source_id": "fa_ctx_010_src_a", "source_version_id": "fa_ctx_010_src_a_v1", "canonical_text": "در ماه گذشته ۱۲۰۰ سفارش ثبت شده و ۳۰ درصد مشتریان از موبایل وارد شده‌اند." }] },
  "expected_structured_output": { "items": [
    { "gold_item_id": "fa_ctx_010_f1", "item_type": "fact", "content": "۱۲۰۰ سفارش در ماه گذشته", "source_refs": [{ "source_id": "fa_ctx_010_src_a", "source_version_id": "fa_ctx_010_src_a_v1" }], "trace_required": true },
    { "gold_item_id": "fa_ctx_010_f2", "item_type": "fact", "content": "۳۰٪ ورود از موبایل", "source_refs": [{ "source_id": "fa_ctx_010_src_a", "source_version_id": "fa_ctx_010_src_a_v1" }], "trace_required": true }
  ], "forbidden_claims": [], "required_item_ids": ["fa_ctx_010_f1", "fa_ctx_010_f2"] },
  "expected_labels": { "clarity": "clear", "has_assumption": false, "has_constraint": false, "has_decision": false, "requires_unknown": false, "prompt_injection": false, "unsupported_assumption": false },
  "provenance_expectations": { "allowed_source_ids": ["fa_ctx_010_src_a"], "trace_required_item_ids": ["fa_ctx_010_f1", "fa_ctx_010_f2"], "offset_policy": "optional", "whole_version_reference_allowed": true },
  "failure_expectations": { "expected_outcome": "success", "allowed_failure_codes": [], "must_not_persist_on_failure": true },
  "metadata": { "synthetic": true, "segment": "clear", "difficulty": "basic", "phenomena": ["fact", "numeric"], "fixture_version": "1" }
}
