{
  "fixture_id": "fa_ctx_018",
  "eval_set_id": "context_structuring_eval_v1",
  "language": "fa",
  "project_type": "corporate",
  "input": { "sources": [{ "source_id": "fa_ctx_018_src_a", "source_version_id": "fa_ctx_018_src_a_v1", "canonical_text": "محصول برای نوجوانان طراحی می‌شود. بعد گفته شده مخاطب اصلی مدیران ارشد سازمان‌ها هستند." }] },
  "expected_structured_output": { "items": [
    { "gold_item_id": "fa_ctx_018_f1", "item_type": "fact", "content": "نوجوانان مخاطب اعلام‌شده", "source_refs": [{ "source_id": "fa_ctx_018_src_a", "source_version_id": "fa_ctx_018_src_a_v1" }], "trace_required": true },
    { "gold_item_id": "fa_ctx_018_f2", "item_type": "fact", "content": "مدیران ارشد مخاطب اعلام‌شده", "source_refs": [{ "source_id": "fa_ctx_018_src_a", "source_version_id": "fa_ctx_018_src_a_v1" }], "trace_required": true },
    { "gold_item_id": "fa_ctx_018_u1", "item_type": "unknown", "content": "تعارض مخاطب", "source_refs": [], "trace_required": false }
  ], "forbidden_claims": [], "required_item_ids": ["fa_ctx_018_f1", "fa_ctx_018_f2", "fa_ctx_018_u1"] },
  "expected_labels": { "clarity": "contradictory", "has_assumption": false, "has_constraint": false, "has_decision": false, "requires_unknown": true, "prompt_injection": false, "unsupported_assumption": false },
  "provenance_expectations": { "allowed_source_ids": ["fa_ctx_018_src_a"], "trace_required_item_ids": ["fa_ctx_018_f1", "fa_ctx_018_f2"], "offset_policy": "optional", "whole_version_reference_allowed": true },
  "failure_expectations": { "expected_outcome": "success", "allowed_failure_codes": [], "must_not_persist_on_failure": true },
  "metadata": { "synthetic": true, "segment": "contradictory", "difficulty": "intermediate", "phenomena": ["fact", "unknown", "conflict"], "fixture_version": "1" }
}
